{
  "schema_version": "0.1",
  "dataset_id": "DATASET-HONDA-CBR150-TH-2021-E3",
  "status": "working",
  "source_id": "SRC-HONDA-THA-PEC-CBR150R-2021-2026",
  "observed_at": "2026-09-14",
  "applicability": {
    "manufacturer": "Honda",
    "model": "CBR150R",
    "market": "Thailand",
    "year": 2021,
    "serial_range": null,
    "area_code": null
  },
  "catalog_locator": {
    "block": "E-3 CAMSHAFT/VALVE",
    "page": null
  },
  "price_policy": "Live PEC prices are deliberately excluded because they are commercial and time-variant, not engineering parameters.",
  "items": [
    { "reference_number": "1", "part_number": "12209-K56-N01", "description": "ซีลก้านวาล์ว (NOK)", "quantity": 4, "status": "verified", "notes": "PEC returned this and 12209-ML0-722 for the same reference; substitution or supersession direction is not stated." },
    { "reference_number": "1", "part_number": "12209-ML0-722", "description": "ซีลก้านวาล์ว", "quantity": 4, "status": "verified", "notes": "PEC returned this and 12209-K56-N01 for the same reference; substitution or supersession direction is not stated." },
    { "reference_number": "2", "part_number": "14110-K56-N00", "description": "เพลาลูกเบี้ยวไอดี", "quantity": 1, "status": "verified", "notes": null },
    { "reference_number": "3", "part_number": "14210-K56-N00", "description": "เพลาลูกเบี้ยวไอเสีย", "quantity": 1, "status": "verified", "notes": null },
    { "reference_number": "4", "part_number": "14430-K56-N00", "description": "กระเดื่องวาล์วไอดี", "quantity": 1, "status": "verified", "notes": "The row was selected during the same live E-3 session before the ordered reference pass; the reference number is also shown by the E-3 exploded-view mapping." },
    { "reference_number": "5", "part_number": "14440-K56-N00", "description": "กระเดื่องวาล์วไอเสีย", "quantity": 1, "status": "verified", "notes": null },
    { "reference_number": "6", "part_number": "14451-K56-N00", "description": "แกนกระเดื่องวาล์ว", "quantity": 2, "status": "verified", "notes": null },
    { "reference_number": "7", "part_number": "14711-K56-N00", "description": "วาล์วไอดี", "quantity": 2, "status": "verified", "notes": null },
    { "reference_number": "8", "part_number": "14721-K56-N00", "description": "วาล์วไอเสีย", "quantity": 2, "status": "verified", "notes": null },
    { "reference_number": "9", "part_number": "14751-K45-N41", "description": "สปริงวาล์วตัวนอก", "quantity": 4, "status": "verified", "notes": "PEC also returned 14751-K56-N01 for this reference; substitution or supersession direction is not stated." },
    { "reference_number": "9", "part_number": "14751-K56-N01", "description": "สปริงวาล์วตัวนอก", "quantity": 4, "status": "verified", "notes": "PEC also returned 14751-K45-N41 for this reference; substitution or supersession direction is not stated." },
    { "reference_number": "10", "part_number": "14761-K45-N41", "description": "สปริงวาล์วตัวใน", "quantity": 4, "status": "verified", "notes": "PEC also returned 14761-K56-N01 for this reference; substitution or supersession direction is not stated." },
    { "reference_number": "10", "part_number": "14761-K56-N01", "description": "สปริงวาล์วตัวใน", "quantity": 4, "status": "verified", "notes": "PEC also returned 14761-K45-N41 for this reference; substitution or supersession direction is not stated." },
    { "reference_number": "11", "part_number": "14771-K45-NL0", "description": "แผ่นรองสปริงวาล์ว", "quantity": 4, "status": "verified", "notes": null },
    { "reference_number": "12", "part_number": "14775-K56-N00", "description": "แหวนรองสปริงวาล์ว", "quantity": 4, "status": "verified", "notes": null },
    { "reference_number": "13", "part_number": "14781-ML0-720", "description": "เล็บวาล์ว", "quantity": 8, "status": "verified", "notes": null }
  ],
  "parameter_series": [
    {
      "reference_number": "14",
      "description": "แผ่นรอง",
      "quantity": 4,
      "parameter_id": "valvetrain.shim_thickness",
      "unit": "mm",
      "evidence_level": "A",
      "value_class": "factory",
      "method": "factory_spec",
      "status": "verified",
      "declared_range": { "start": 1.5, "end": 2.9, "step": 0.025 },
      "members": [
        { "part_number": "14913-KT7-013", "value": 1.5 },
        { "part_number": "14914-KT7-013", "value": 1.525 },
        { "part_number": "14915-KT7-013", "value": 1.55 },
        { "part_number": "14916-KT7-013", "value": 1.575 },
        { "part_number": "14917-KT7-013", "value": 1.6 },
        { "part_number": "14918-KT7-013", "value": 1.625 },
        { "part_number": "14919-KT7-013", "value": 1.65 },
        { "part_number": "14920-KT7-013", "value": 1.675 },
        { "part_number": "14921-KT7-013", "value": 1.7 },
        { "part_number": "14922-KT7-013", "value": 1.725 },
        { "part_number": "14923-KT7-013", "value": 1.75 },
        { "part_number": "14924-KT7-013", "value": 1.775 },
        { "part_number": "14925-KT7-013", "value": 1.8 },
        { "part_number": "14926-KT7-013", "value": 1.825 },
        { "part_number": "14927-KT7-013", "value": 1.85 },
        { "part_number": "14928-KT7-013", "value": 1.875 },
        { "part_number": "14929-KT7-013", "value": 1.9 },
        { "part_number": "14930-KT7-013", "value": 1.925 },
        { "part_number": "14931-KT7-013", "value": 1.95 },
        { "part_number": "14932-KT7-013", "value": 1.975 },
        { "part_number": "14933-KT7-013", "value": 2.0 },
        { "part_number": "14934-KT7-013", "value": 2.025 },
        { "part_number": "14935-KT7-013", "value": 2.05 },
        { "part_number": "14936-KT7-013", "value": 2.075 },
        { "part_number": "14937-KT7-013", "value": 2.1 },
        { "part_number": "14938-KT7-013", "value": 2.125 },
        { "part_number": "14939-KT7-013", "value": 2.15 },
        { "part_number": "14940-KT7-013", "value": 2.175 },
        { "part_number": "14941-KT7-013", "value": 2.2 },
        { "part_number": "14942-KT7-013", "value": 2.225 },
        { "part_number": "14943-KT7-013", "value": 2.25 },
        { "part_number": "14944-KT7-013", "value": 2.275 },
        { "part_number": "14945-KT7-013", "value": 2.3 },
        { "part_number": "14946-KT7-013", "value": 2.325 },
        { "part_number": "14947-KT7-013", "value": 2.35 },
        { "part_number": "14948-KT7-013", "value": 2.375 },
        { "part_number": "14949-KT7-013", "value": 2.4 },
        { "part_number": "14950-KT7-013", "value": 2.425 },
        { "part_number": "14951-KT7-013", "value": 2.45 },
        { "part_number": "14952-KT7-013", "value": 2.475 },
        { "part_number": "14953-KT7-013", "value": 2.5 },
        { "part_number": "14954-KT7-013", "value": 2.525 },
        { "part_number": "14955-KT7-013", "value": 2.55 },
        { "part_number": "14956-KT7-013", "value": 2.575 },
        { "part_number": "14957-KT7-013", "value": 2.6 },
        { "part_number": "14958-KT7-013", "value": 2.625 },
        { "part_number": "14959-KT7-013", "value": 2.65 },
        { "part_number": "14960-KT7-013", "value": 2.675 },
        { "part_number": "14961-KT7-013", "value": 2.7 },
        { "part_number": "14962-KT7-013", "value": 2.725 },
        { "part_number": "14963-KT7-013", "value": 2.75 },
        { "part_number": "14964-KT7-013", "value": 2.775 },
        { "part_number": "14965-KT7-013", "value": 2.8 },
        { "part_number": "14966-KT7-013", "value": 2.825 },
        { "part_number": "14967-KT7-013", "value": 2.85 },
        { "part_number": "14968-KT7-013", "value": 2.875 },
        { "part_number": "14969-KT7-013", "value": 2.9 }
      ],
      "notes": "The values are explicitly printed in each PEC part description. The series form prevents repeated provenance fields while retaining every part-number-to-thickness mapping."
    }
  ],
  "unresolved_references": [],
  "notes": "This extraction contains 73 unique part numbers: 16 ordinary catalog rows and 57 shim variants. Shared source and applicability fields apply to every item and series member. No cam profile, valve geometry, spring rate, material, tolerance, or mass is inferred."
}
